<?xml version="1.0" encoding="UTF-8"?>
<ro:Road xmlns:gml="http://www.opengis.net/gml/3.2"
    xmlns:xlink="http://www.w3.org/1999/xlink"
    xmlns:gmd="http://www.isotc211.org/2005/gmd"
    xmlns:gco="http://www.isotc211.org/2005/gco"
    xmlns:gsr="http://www.isotc211.org/2005/gsr"
    xmlns:gts="http://www.isotc211.org/2005/gts"
    xmlns:gss="http://www.isotc211.org/2005/gss"
    xmlns:net="http://gis-t.motc.gov.tw/standards/schema/TransportNetwork"
    xmlns:ro="http://gis-t.motc.gov.tw/standards/schema/RoadNetwork"
    xmlns:xsi="http://www.w3.org/2001/XMLSchema-instance"    
    xsi:schemaLocation="http://gis-t.motc.gov.tw/standards/schema/RoadNetwork ../XSD/motcRoadNetworkElemts.xsd" 
    roadID="6-00489">
        <!-- 市區道路6-00489有以下線段組成-->
        <net:links>
            <ro:RoadLink roadLinkID="roadlink001" />
            <!-- 其中以下線段有共線 -->
            <ro:RoadLink roadLinkID="roadlink002">
                <ro:affiliatedRoads>
                    <!--此線段屬縣道-->
                    <ro:Road roadID="4-01250">
                        <roadClass>2W</roadClass>
                        <roadCode>125</roadCode>
                        <roadName>縣125</roadName>                        
                    </ro:Road>
                    <!--同時與市區道路共線-->
                    <ro:Road roadID="6-00489">
                        <roadClass>RD</roadClass>
                        <roadCode>6</roadCode>
                        <roadName>市6</roadName> 
                    </ro:Road>                    
                </ro:affiliatedRoads>
            </ro:RoadLink>
        </net:links>
        
    <roadClass>RD</roadClass>
    <roadName>西屯路三段</roadName>
</ro:Road>

